{
  "schemaVersion": "clearcutt.catalog.image/v2",
  "id": "postgres16",
  "kind": "service",
  "language": {
    "id": "service",
    "displayName": "Service",
    "version": "16",
    "icon": null
  },
  "tier": {
    "id": "service",
    "name": "Service",
    "blurb": "Platform-owned service image"
  },
  "registry": "ghcr.io/test-owner/test-repo",
  "imageName": "clearcutt-postgres16",
  "fullName": "ghcr.io/test-owner/test-repo/clearcutt-postgres16",
  "lifecycle": {
    "status": "preview",
    "support": "current",
    "productionAllowed": false,
    "deprecatedAt": null,
    "eolAt": null,
    "reason": null
  },
  "runtimeContract": {
    "user": "10001:10001",
    "workingDir": "/app",
    "shellPresent": true,
    "packageManagerPresent": false,
    "caCertificatesPresent": true,
    "timezoneDataPresent": false,
    "defaultEntrypoint": "/bin/clearcutt-postgres-entrypoint",
    "productionTier": false
  },
  "service": {
    "template": "postgres",
    "version": "16",
    "ports": [
      { "name": "postgres", "port": 5432, "protocol": "tcp" }
    ],
    "stateful": true,
    "dataDirs": ["/var/lib/postgresql/data"],
    "smoke": ["postgres --version", "initdb --version", "pg_isready --version"],
    "smokeStatus": "passed"
  },
  "releases": [
    {
      "tag": "v1.0.0",
      "publishedAt": "2026-06-05T20:00:00Z",
      "lastRebuiltAt": "2026-06-05T20:10:00Z",
      "isLatest": true,
      "manifestDigest": "sha256:abcdef1234567890abcdef1234567890abcdef1234567890abcdef1234567890",
      "totalSize": 40960,
      "architectures": [
        {
          "arch": "amd64",
          "os": "linux",
          "imageDigest": "sha256:postgres-amd64",
          "imageSize": 40960,
          "layerCount": 2,
          "layers": [
            { "digest": "sha256:postgres-layer", "size": 20480, "diffID": null },
            { "digest": "sha256:postgres-data-dir", "size": 1024, "diffID": "sha256:postgres-data-diff" }
          ],
          "labels": {
            "org.opencontainers.image.title": "clearcutt-postgres16",
            "org.opencontainers.image.ref.name": "service",
            "dev.clearcutt.image.kind": "service",
            "dev.clearcutt.service.id": "postgres16",
            "dev.clearcutt.service.template": "postgres",
            "dev.clearcutt.service.version": "16"
          },
          "sbom": {
            "tool": "syft",
            "createdAt": "2026-06-05T20:00:00Z",
            "rootDigest": "sha256:postgres-root",
            "packageCount": 3,
            "packages": [
              {
                "name": "postgresql",
                "version": "16.9",
                "purl": null,
                "cpes": [],
                "license": "PostgreSQL",
                "supplier": "Nix",
                "nixStorePath": "/nix/store/postgresql-16.9",
                "spdxId": "SPDXRef-postgresql",
                "layerDigest": "sha256:postgres-layer"
              },
              {
                "name": "coreutils",
                "version": "9.5",
                "purl": null,
                "cpes": [],
                "license": "GPL-3.0-or-later",
                "supplier": "Nix",
                "nixStorePath": "/nix/store/coreutils-9.5",
                "spdxId": "SPDXRef-coreutils",
                "layerDigest": "sha256:postgres-layer"
              },
              {
                "name": "cacert",
                "version": "3.107",
                "purl": null,
                "cpes": [],
                "license": "MPL-2.0",
                "supplier": "Nix",
                "nixStorePath": "/nix/store/cacert",
                "spdxId": "SPDXRef-cacert",
                "layerDigest": "sha256:postgres-layer"
              }
            ]
          },
          "testResults": {
            "status": "passed",
            "timestamp": "2026-06-05T20:00:00Z",
            "assertions": [
              { "name": "SBOM generation", "status": "passed" },
              { "name": "Service smoke", "status": "passed" }
            ]
          },
          "vulnerabilities": {
            "scannedAt": "2026-06-05T20:10:00Z",
            "scanner": "grype",
            "dbBuiltAt": null,
            "countsBySeverity": {
              "critical": 0,
              "high": 0,
              "medium": 0,
              "low": 0,
              "negligible": 0,
              "unknown": 0
            },
            "findings": []
          }
        }
      ],
      "signature": {
        "cosignBundlePresent": true,
        "certificate": {
          "subject": "https://github.com/test-owner/test-repo/.github/workflows/release.yml@refs/heads/main",
          "issuer": "https://token.actions.githubusercontent.com"
        }
      },
      "provenance": {
        "predicateType": "https://slsa.dev/provenance/v1",
        "builder": { "id": "test-builder" },
        "slsaLevel": 3
      },
      "attestations": [
        {
          "kind": "slsa-provenance",
          "predicateType": "https://slsa.dev/provenance/v1",
          "subjectName": "ghcr.io/test-owner/test-repo/clearcutt-postgres16",
          "subjectDigest": "sha256:abcdef1234567890abcdef1234567890abcdef1234567890abcdef1234567890",
          "signerIdentity": "https://github.com/test-owner/test-repo/.github/workflows/release.yml@refs/heads/main",
          "issuer": "https://token.actions.githubusercontent.com",
          "runUrl": "https://github.com/test-owner/test-repo/actions/runs/1/attempts/1",
          "workflowUrl": "https://github.com/test-owner/test-repo/actions/workflows/release.yml",
          "githubApiUrl": "https://api.github.com/users/test-owner/attestations/sha256:abcdef",
          "releaseAssetUrl": "https://example.invalid/postgres16.intoto.jsonl",
          "transparencyLogIndex": 123,
          "transparencyUrl": "https://search.sigstore.dev/?logIndex=123",
          "sources": ["oci", "github"]
        }
      ],
      "assetUrls": {
        "sbom": {
          "amd64": "https://example.invalid/postgres16-amd64.sbom.json"
        },
        "provenance": "https://example.invalid/postgres16.intoto.jsonl",
        "testResults": {
          "amd64": "https://example.invalid/postgres16-amd64.test-results.json"
        },
        "digest": "https://example.invalid/postgres16.digest.json"
      },
      "evidence": {
        "signature": true,
        "provenance": true,
        "sbom": true,
        "tests": true,
        "vulnerabilities": true,
        "archCount": 1,
        "sbomArchCount": 1,
        "testArchCount": 1,
        "passedTestArchCount": 1,
        "vulnerabilityArchCount": 1
      },
      "lifecycle": {
        "status": "preview",
        "support": "current",
        "productionAllowed": false,
        "deprecatedAt": null,
        "eolAt": null,
        "reason": null
      },
      "runtimeContract": {
        "user": "10001:10001",
        "workingDir": "/app",
        "shellPresent": true,
        "packageManagerPresent": false,
        "caCertificatesPresent": true,
        "timezoneDataPresent": false,
        "defaultEntrypoint": "/bin/clearcutt-postgres-entrypoint",
        "productionTier": false
      },
      "exceptions": {
        "total": 0,
        "expired": 0,
        "active": 0,
        "acceptedRisk": 0,
        "noFixAvailable": 0,
        "falsePositive": 0,
        "inheritedFromBase": 0
      }
    }
  ]
}
