{
  "schemaVersion": "clearcutt.catalog.image/v2",
  "id": "java21-distroless",
  "kind": "runtime",
  "language": {
    "id": "java",
    "displayName": "Java",
    "version": "21",
    "icon": null
  },
  "tier": {
    "id": "distroless",
    "name": "Distroless",
    "blurb": "Hardened tier"
  },
  "registry": "ghcr.io/test-owner/test-repo",
  "imageName": "clearcutt-java",
  "fullName": "ghcr.io/test-owner/test-repo/clearcutt-java",
  "lifecycle": {
    "status": "active",
    "support": "lts",
    "productionAllowed": true,
    "deprecatedAt": null,
    "eolAt": null,
    "reason": null
  },
  "runtimeContract": {
    "user": "10001",
    "workingDir": "/app",
    "shellPresent": false,
    "packageManagerPresent": false,
    "caCertificatesPresent": true,
    "timezoneDataPresent": true,
    "defaultEntrypoint": "/usr/local/bin/java",
    "productionTier": true
  },
  "releases": [
    {
      "tag": "v1.0.0",
      "publishedAt": "2026-06-05T20:00:00Z",
      "lastRebuiltAt": "2026-06-05T20:10:00Z",
      "isLatest": true,
      "manifestDigest": "sha256:1234567890abcdef1234567890abcdef1234567890abcdef1234567890abcdef",
      "totalSize": 10240,
      "architectures": [
        {
          "arch": "amd64",
          "os": "linux",
          "imageDigest": "sha256:runtime-amd64",
          "imageSize": 10240,
          "layerCount": 1,
          "layers": [
            { "digest": "sha256:runtime-layer", "size": 5120, "diffID": null }
          ],
          "labels": {
            "org.opencontainers.image.title": "clearcutt-java-21",
            "org.opencontainers.image.ref.name": "distroless"
          },
          "sbom": {
            "tool": "syft",
            "createdAt": "2026-06-05T20:00:00Z",
            "rootDigest": "sha256:runtime-root",
            "packageCount": 2,
            "packages": [
              {
                "name": "openjdk",
                "version": "21.0.1",
                "purl": null,
                "cpes": [],
                "license": "GPL-2.0-only WITH Classpath-exception-2.0",
                "supplier": "Nix",
                "nixStorePath": "/nix/store/java21-openjdk",
                "spdxId": "SPDXRef-openjdk",
                "layerDigest": "sha256:runtime-layer"
              },
              {
                "name": "cacert",
                "version": "3.107",
                "purl": null,
                "cpes": [],
                "license": "MPL-2.0",
                "supplier": "Nix",
                "nixStorePath": "/nix/store/cacert",
                "spdxId": "SPDXRef-cacert",
                "layerDigest": "sha256:runtime-layer"
              }
            ]
          },
          "testResults": {
            "status": "passed",
            "timestamp": "2026-06-05T20:00:00Z",
            "assertions": [
              { "name": "SBOM generation", "status": "passed" }
            ]
          },
          "vulnerabilities": {
            "scannedAt": "2026-06-05T20:10:00Z",
            "scanner": "grype",
            "dbBuiltAt": null,
            "countsBySeverity": {
              "critical": 0,
              "high": 0,
              "medium": 0,
              "low": 0,
              "negligible": 0,
              "unknown": 0
            },
            "findings": []
          }
        }
      ],
      "signature": {
        "cosignBundlePresent": true,
        "certificate": {
          "subject": "https://github.com/test-owner/test-repo/.github/workflows/release.yml@refs/heads/main",
          "issuer": "https://token.actions.githubusercontent.com"
        }
      },
      "provenance": {
        "predicateType": "https://slsa.dev/provenance/v1",
        "builder": { "id": "test-builder" },
        "slsaLevel": 3
      },
      "attestations": [],
      "assetUrls": {
        "sbom": {
          "amd64": "https://example.invalid/java21-distroless-amd64.sbom.json"
        },
        "provenance": "https://example.invalid/java21-distroless.intoto.jsonl",
        "testResults": {
          "amd64": "https://example.invalid/java21-distroless-amd64.test-results.json"
        },
        "digest": "https://example.invalid/java21-distroless.digest.json"
      },
      "evidence": {
        "signature": true,
        "provenance": true,
        "sbom": true,
        "tests": true,
        "vulnerabilities": true,
        "archCount": 1,
        "sbomArchCount": 1,
        "testArchCount": 1,
        "passedTestArchCount": 1,
        "vulnerabilityArchCount": 1
      },
      "lifecycle": {
        "status": "active",
        "support": "lts",
        "productionAllowed": true,
        "deprecatedAt": null,
        "eolAt": null,
        "reason": null
      },
      "runtimeContract": {
        "user": "10001",
        "workingDir": "/app",
        "shellPresent": false,
        "packageManagerPresent": false,
        "caCertificatesPresent": true,
        "timezoneDataPresent": true,
        "defaultEntrypoint": "/usr/local/bin/java",
        "productionTier": true
      },
      "exceptions": {
        "total": 0,
        "expired": 0,
        "active": 0,
        "acceptedRisk": 0,
        "noFixAvailable": 0,
        "falsePositive": 0,
        "inheritedFromBase": 0
      }
    }
  ]
}
